{
  "schema": "rozkalns.simple-deploy.consumer.v1",
  "repository": "rozkalnsandris/example-service",
  "image": "ghcr.io/rozkalnsandris/example-service",
  "build": {
    "context": ".",
    "dockerfile": "Dockerfile",
    "architecture": "linux/arm64"
  },
  "target": {
    "alias": "example-service-rpi5",
    "runtime_class": "rpi5-compose"
  },
  "compose": {
    "project": "example-service",
    "file": "compose.production.yml",
    "service": "app"
  },
  "health": {
    "liveness_path": "/health",
    "readiness": {
      "state": "required",
      "path": "/ready"
    }
  },
  "persistence": {
    "volumes": []
  },
  "registry": {
    "pull_profile": "public-anonymous-pull"
  },
  "forbidden_operations": [
    "database-schema-data-mutation",
    "destructive-recovery",
    "secrets-credentials-permissions",
    "cloudflare-dns-network",
    "private-provider-activation",
    "unrelated-host-control"
  ]
}
